<?xml version="1.0" encoding="UTF-8"?>
<!-- edited with XMLSPY v5 rel. 2 U (http://www.xmlspy.com) by Son H. Kim (JGCRI) -->
<!--Sample XML file generated by XMLSPY v5 rel. 2 U (http://www.xmlspy.com)-->
<scenario xmlns:xsi="http://www.w3.org/2001/XMLSchema-instance" xsi:noNamespaceSchemaLocation="C:\PNNL\CIAM\INPUT\myxml\Ciam.xsd" name="ReferenceScenario" date="2003-01-03T13:40:47-05:00">
	<summary>Reference Scenario based on SRES B2 Scenario</summary>
	<modeltime>
		<startyear>1975</startyear>
		<interyear1>2005</interyear1>
		<interyear2>2050</interyear2>
		<endyear>2095</endyear>
		<timestep1>15</timestep1>
		<timestep2>15</timestep2>
		<timestep3>15</timestep3>
		<popbegin>1960</popbegin>
		<dataend>2095</dataend>
		<datatimestep>15</datatimestep>
	</modeltime>
	<world>
		<region name="USA">
			<demographics>
				<population>
					<year>1960</year>
					<total>180738</total>
					<datainfo>
						<unit>String</unit>
						<source>String</source>
						<note>String</note>
					</datainfo>
				</population>
				<population>
					<year>1975</year>
					<total>216067</total>
					<datainfo>
						<unit>String</unit>
						<source>String</source>
						<note>String</note>
					</datainfo>
				</population>
				<population>
					<year>1990</year>
					<total>249012</total>
					<datainfo>
						<unit>String</unit>
						<source>String</source>
						<note>String</note>
					</datainfo>
				</population>
				<population>
					<year>2005</year>
					<total>291604</total>
					<datainfo>
						<unit>String</unit>
						<source>String</source>
						<note>String</note>
					</datainfo>
				</population>
				<population>
					<year>2020</year>
					<total>327682</total>
					<datainfo>
						<unit>String</unit>
						<source>String</source>
						<note>String</note>
					</datainfo>
				</population>
				<population>
					<year>2035</year>
					<total>361786</total>
					<datainfo>
						<unit>String</unit>
						<source>String</source>
						<note>String</note>
					</datainfo>
				</population>
				<population>
					<year>2050</year>
					<total>384810</total>
					<datainfo>
						<unit>String</unit>
						<source>String</source>
						<note>String</note>
					</datainfo>
				</population>
				<population>
					<year>2065</year>
					<total>406002</total>
					<datainfo>
						<unit>String</unit>
						<source>String</source>
						<note>String</note>
					</datainfo>
				</population>
				<population>
					<year>2080</year>
					<total>432120</total>
					<datainfo>
						<unit>String</unit>
						<source>String</source>
						<note>String</note>
					</datainfo>
				</population>
				<population>
					<year>2095</year>
					<total>457962</total>
					<datainfo>
						<unit>String</unit>
						<source>String</source>
						<note>String</note>
					</datainfo>
				</population>
				<laborproductivity>
					<year>1975</year>
					<growthrate>0.017</growthrate>
					<datainfo>
						<unit>String</unit>
						<source>String</source>
						<note>String</note>
					</datainfo>
				</laborproductivity>
				<laborproductivity>
					<year>1990</year>
					<growthrate>0.0118239</growthrate>
					<datainfo>
						<unit>String</unit>
						<source>String</source>
						<note>String</note>
					</datainfo>
				</laborproductivity>
				<laborproductivity>
					<year>2005</year>
					<growthrate>0.01622415</growthrate>
					<datainfo>
						<unit>String</unit>
						<source>String</source>
						<note>String</note>
					</datainfo>
				</laborproductivity>
				<laborproductivity>
					<year>2020</year>
					<growthrate>0.01321581</growthrate>
					<datainfo>
						<unit>String</unit>
						<source>String</source>
						<note>String</note>
					</datainfo>
				</laborproductivity>
				<laborproductivity>
					<year>2035</year>
					<growthrate>0.01150848</growthrate>
					<datainfo>
						<unit>String</unit>
						<source>String</source>
						<note>String</note>
					</datainfo>
				</laborproductivity>
				<laborproductivity>
					<year>2050</year>
					<growthrate>0.00763224</growthrate>
					<datainfo>
						<unit>String</unit>
						<source>String</source>
						<note>String</note>
					</datainfo>
				</laborproductivity>
				<laborproductivity>
					<year>2065</year>
					<growthrate>0.00896513</growthrate>
					<datainfo>
						<unit>String</unit>
						<source>String</source>
						<note>String</note>
					</datainfo>
				</laborproductivity>
				<laborproductivity>
					<year>2080</year>
					<growthrate>0.00937597</growthrate>
					<datainfo>
						<unit>String</unit>
						<source>String</source>
						<note>String</note>
					</datainfo>
				</laborproductivity>
				<laborproductivity>
					<year>2095</year>
					<growthrate>0.01166821</growthrate>
					<datainfo>
						<unit>String</unit>
						<source>String</source>
						<note>String</note>
					</datainfo>
				</laborproductivity>
				<laborforce>
					<year>1975</year>
					<part_rate>0.45</part_rate>
					<datainfo>
						<unit>String</unit>
						<source>String</source>
						<note>String</note>
					</datainfo>
				</laborforce>
				<laborforce>
					<year>1990</year>
					<part_rate>0.5</part_rate>
					<datainfo>
						<unit>String</unit>
						<source>String</source>
						<note>String</note>
					</datainfo>
				</laborforce>
				<laborforce>
					<year>2005</year>
					<part_rate>0.52</part_rate>
					<datainfo>
						<unit>String</unit>
						<source>String</source>
						<note>String</note>
					</datainfo>
				</laborforce>
				<laborforce>
					<year>2020</year>
					<part_rate>0.52</part_rate>
					<datainfo>
						<unit>String</unit>
						<source>String</source>
						<note>String</note>
					</datainfo>
				</laborforce>
				<laborforce>
					<year>2035</year>
					<part_rate>0.49</part_rate>
					<datainfo>
						<unit>String</unit>
						<source>String</source>
						<note>String</note>
					</datainfo>
				</laborforce>
				<laborforce>
					<year>2050</year>
					<part_rate>0.49</part_rate>
					<datainfo>
						<unit>String</unit>
						<source>String</source>
						<note>String</note>
					</datainfo>
				</laborforce>
				<laborforce>
					<year>2065</year>
					<part_rate>0.48</part_rate>
					<datainfo>
						<unit>String</unit>
						<source>String</source>
						<note>String</note>
					</datainfo>
				</laborforce>
				<laborforce>
					<year>2080</year>
					<part_rate>0.47</part_rate>
					<datainfo>
						<unit>String</unit>
						<source>String</source>
						<note>String</note>
					</datainfo>
				</laborforce>
				<laborforce>
					<year>2095</year>
					<part_rate>0.45</part_rate>
					<datainfo>
						<unit>String</unit>
						<source>String</source>
						<note>String</note>
					</datainfo>
				</laborforce>
			</demographics>
			<resource name="crude oil">
				<market>String</market>
				<price>3.14159265358979</price>
				<subresource>
					<name>Name</name>
					<period>
						<grade>
							<name>grade1</name>
							<year>1975</year>
							<available/>
							<extractioncost/>
							<environmentalcost/>
							<severencetax/>
							<techchange/>
							<datainfo>
								<unit/>
								<source/>
								<note/>
							</datainfo>
						</grade>
					</period>
				</subresource>
			</resource>
			<supplysector>
				<name>electricity</name>
				<market>String</market>
				<price>3.14159265358979</price>
				<subsector>
					<name>coal</name>
					<capacitylimit>3.14159265358979</capacitylimit>
					<sharewt>3.14159265358979</sharewt>
					<logitexp>3.14159265358979</logitexp>
					<technology>
						<period>
							<name>pulverized_coal</name>
							<year>1975</year>
							<fuelname>coal</fuelname>
							<sharewt/>
							<efficiency/>
							<nonenergycost/>
							<tax/>
							<logitexp/>
							<techchange/>
							<datainfo>
								<unit/>
								<source/>
								<note/>
							</datainfo>
							<GHG>
								<name>CO2</name>
								<unit>MTC</unit>
								<emisscoef/>
								<removefrac/>
								<GWP/>
								<datainfo>
									<unit/>
									<source/>
									<note/>
								</datainfo>
							</GHG>
						</period>
					</technology>
				</subsector>
			</supplysector>
			<demandsector>
				<name>transportation</name>
				<market>String</market>
				<price>3.14159265358979</price>
				<serviceoutput>3.14159265358979</serviceoutput>
				<energyconsumption>3.14159265358979</energyconsumption>
				<priceelasticity>3.14159265358979</priceelasticity>
				<incomeelasticity>3.14159265358979</incomeelasticity>
				<subsector>
					<name>passenger</name>
					<capacitylimit>3.14159265358979</capacitylimit>
					<sharewt>3.14159265358979</sharewt>
					<logitexp>3.14159265358979</logitexp>
					<technology>
						<period>
							<name>automobile</name>
							<year>1975</year>
							<fuelname>gasoline</fuelname>
							<sharewt/>
							<efficiency/>
							<nonenergycost/>
							<tax/>
							<logitexp/>
							<techchange/>
							<datainfo>
								<unit/>
								<source/>
								<note/>
							</datainfo>
							<GHG>
								<name>CO2</name>
								<unit>MTC</unit>
								<emisscoef/>
								<removefrac/>
								<GWP/>
								<datainfo>
									<unit/>
									<source/>
									<note/>
								</datainfo>
							</GHG>
						</period>
					</technology>
				</subsector>
			</demandsector>
			<ghgmarket>
				<ghgname>Name</ghgname>
				<year>0</year>
				<market>String</market>
				<constraint>3.14159265358979</constraint>
				<note>String</note>
			</ghgmarket>
		</region>
		<region name="Canada">
			<demographics>
				<population>
					<year>1960</year>
					<total>17909</total>
					<datainfo>
						<unit>String</unit>
						<source>String</source>
						<note>String</note>
					</datainfo>
				</population>
				<population>
					<year>1975</year>
					<total>23209</total>
					<datainfo>
						<unit>String</unit>
						<source>String</source>
						<note>String</note>
					</datainfo>
				</population>
				<population>
					<year>1990</year>
					<total>29003</total>